topic,difficulty,question,option_a,option_b,option_c,correct_answer,explanation
Machine Learning,1,What does ML stand for?,Meta Learning,Model Logic,Multilayer Learning,Machine Learning,"ML stands for Machine Learning, a subset of AI that learns from data."
Machine Learning,1,Which learning type uses labeled data?,Unsupervised,Reinforcement,Self-supervised,Supervised,Supervised learning trains on labeled input-output pairs.
Machine Learning,2,What is overfitting?,Model too simple,Model ignores data,Model trains too fast,Model memorizes training data,Overfitting occurs when a model learns noise and fails to generalize.
Machine Learning,2,What is a feature in ML?,Output label,Model weight,Bias term,Input variable,Features are the input variables used to make predictions.
Machine Learning,2,What is cross-validation?,Training technique,Data cleaning,Model compression,Model evaluation technique,Cross-validation evaluates model performance by splitting data into multiple folds.
Machine Learning,3,What is the bias-variance tradeoff?,Speed vs accuracy,Training vs test split,Precision vs recall,Underfitting vs overfitting balance,High bias causes underfitting; high variance causes overfitting.
Machine Learning,3,What does regularization do?,Speeds up training,Increases complexity,Adds more data,Prevents overfitting,Regularization adds a penalty term to reduce model complexity.
Machine Learning,3,What is gradient descent?,A dataset split,Evaluation metric,A neural layer,Optimization algorithm,Gradient descent minimizes loss by iteratively updating parameters.
Machine Learning,4,What is the kernel trick in SVM?,Data normalization,Reduces features,Removes outliers,Maps data to higher dimensions,The kernel trick implicitly maps data to higher-dimensional space.
Machine Learning,4,What is ensemble learning?,Single model training,Feature selection,Data augmentation,Combining multiple models,Ensemble methods combine predictions from multiple models to improve accuracy.
Machine Learning,4,What does the ROC curve measure?,Regression accuracy,Clustering quality,Feature importance,Binary classifier performance,ROC curve plots true positive rate vs false positive rate for classifiers.
Machine Learning,5,What is the VC dimension?,Model accuracy,Learning rate,Training loss,Measure of model capacity,VC dimension measures the capacity of a hypothesis class.
Machine Learning,5,What is PAC learning?,Partial Accuracy Computation,Predictive Accuracy Check,Probabilistic Accuracy Criterion,Probabilistic Approximate Correct learning,PAC learning defines conditions under which a learning algorithm can generalize.
Machine Learning,3,What is a confusion matrix?,Loss function,Optimization method,Weight matrix,Table of prediction vs actual results,"A confusion matrix shows TP, TN, FP, FN counts for classification evaluation."
Machine Learning,2,What is the train-test split?,Model type,Feature engineering,Hyperparameter tuning,Dividing data for training and evaluation,Train-test split separates data to train the model and evaluate its generalization.
Deep Learning,1,What is a neural network?,A database,A sorting algorithm,A file system,Layers of interconnected nodes,Neural networks are composed of layers of nodes that learn representations from data.
Deep Learning,1,What is an activation function?,Loss function,Weight initializer,Optimizer,Introduces non-linearity,Activation functions introduce non-linearity enabling networks to learn complex patterns.
Deep Learning,2,What does ReLU stand for?,Random Linear Update,Recursive Learning Unit,Regularized Loss Unit,Rectified Linear Unit,"ReLU outputs max(0,x), solving the vanishing gradient problem."
Deep Learning,2,What is backpropagation?,Forward pass,Data augmentation,Weight initialization,Algorithm to compute gradients,Backpropagation computes gradients of the loss using the chain rule.
Deep Learning,2,What is dropout?,Data removal,Activation function,Learning rate decay,Regularization technique,Dropout randomly deactivates neurons during training to prevent overfitting.
Deep Learning,3,What is batch normalization?,Batch size selection,Data preprocessing,Weight clipping,Normalizes layer inputs,Batch normalization normalizes activations within a mini-batch to stabilize training.
Deep Learning,3,What is a loss function?,Model architecture,Optimizer,Activation function,Measures prediction error,The loss function quantifies the difference between predicted and actual outputs.
Deep Learning,3,What is transfer learning?,Training from scratch,Data transfer,Model pruning,Reusing pretrained model weights,Transfer learning leverages knowledge from a pretrained model for a new task.
Deep Learning,4,What is the vanishing gradient problem?,Exploding weights,Slow data loading,Memory overflow,Gradients become too small in deep networks,"In deep networks, gradients shrink exponentially during backprop."
Deep Learning,4,What is an autoencoder?,Supervised classifier,Reinforcement agent,Recurrent network,Unsupervised encoder-decoder network,Autoencoders learn compressed representations by encoding then decoding input data.
Deep Learning,5,What is the attention mechanism?,Data filtering,Gradient clipping,Weight decay,Weighs importance of input parts,Attention allows models to focus on relevant parts of the input.
Deep Learning,5,What is a residual connection?,Dropout variant,Batch norm variant,Pooling layer,Skip connection adding input to output,Residual connections add the input directly to the output enabling very deep networks.
Deep Learning,3,What is an embedding layer?,Pooling layer,Convolutional layer,Recurrent layer,Maps discrete tokens to dense vectors,Embedding layers convert categorical inputs like words into dense vector representations.
Deep Learning,4,What is knowledge distillation?,Data augmentation,Ensemble method,Hyperparameter search,Training small model to mimic large model,Knowledge distillation compresses a large teacher model into a smaller student model.
Neural Networks,1,What is a perceptron?,Multi-layer network,Recurrent unit,Convolutional filter,Single-layer binary classifier,A perceptron is the simplest neural network unit performing binary classification.
Neural Networks,1,What is a weight in a neural network?,Bias term,Activation value,Loss value,Learnable parameter,Weights are learnable parameters determining connection strength between neurons.
Neural Networks,2,What is the output range of sigmoid?,0 to infinity,-1 to 1,-infinity to infinity,0 to 1,The sigmoid function maps any real value to a range between 0 and 1.
Neural Networks,2,What is a hidden layer?,Input layer,Output layer,Embedding layer,Layer between input and output,Hidden layers learn abstract representations of the input data.
Neural Networks,3,What is the softmax function used for?,Binary classification,Regression,Clustering,Multi-class probability output,Softmax converts raw scores to probabilities that sum to 1.
Neural Networks,3,What does a convolutional layer do?,Reduces dimensions,Normalizes inputs,Applies dropout,Applies filters to detect features,Convolutional layers apply learnable filters to detect local patterns.
Neural Networks,3,What is pooling in CNNs?,Weight update,Normalization,Feature expansion,Downsampling feature maps,Pooling reduces spatial dimensions while retaining important features.
Neural Networks,4,What problem does LSTM solve?,Overfitting,Slow training,Exploding gradients,Long-term dependency problem in RNNs,LSTM uses gates to selectively remember or forget information over long sequences.
Neural Networks,4,What does the forget gate in LSTM do?,Add new information,Output final value,Reset hidden state,Decide what to discard from cell state,The forget gate controls what information from the previous cell state is discarded.
Neural Networks,5,What is a GAN?,Graph Attention Network,Gated Activation Node,Gradient Averaging Network,Generative Adversarial Network,GANs consist of a generator and discriminator trained adversarially.
Neural Networks,5,What is mode collapse in GANs?,Training instability,Discriminator overfits,Generator overfits,Generator produces limited variety,Mode collapse occurs when the GAN generator produces only a few types of outputs.
Neural Networks,2,What is weight initialization?,Setting final weights,Updating weights,Pruning weights,Setting initial weight values,Proper weight initialization prevents vanishing/exploding gradients at training start.
NLP,1,What does NLP stand for?,Neural Learning Protocol,Numeric Logic Processing,Natural Language Parsing,Natural Language Processing,NLP is the field of AI focused on enabling computers to understand human language.
NLP,1,What is tokenization?,Model training,Data labeling,Feature extraction,Splitting text into tokens,"Tokenization splits text into words, subwords, or characters for processing."
NLP,2,What is a word embedding?,One-hot encoding,Bag of words,TF-IDF vector,Dense vector representation of words,Word embeddings map words to dense vectors capturing semantic relationships.
NLP,2,What does Word2Vec learn?,Sentence structure,Grammar rules,Syntax trees,Word embeddings from context,Word2Vec learns word embeddings by predicting context words using a shallow neural network.
NLP,2,What does TF-IDF measure?,Sentence similarity,Grammar complexity,Word frequency only,Word importance in a document relative to corpus,TF-IDF measures word importance in a document relative to a corpus.
NLP,3,What does a language model do?,Classify images,Detect objects,Translate languages,Predicts next word probability,Language models assign probabilities to sequences of words.
NLP,3,What is named entity recognition?,Sentiment analysis,Text summarization,Machine translation,Identifying entities like names and places,NER identifies and classifies named entities such as persons and organizations.
NLP,3,What is sentiment analysis?,Topic modeling,Machine translation,Text generation,Determining emotional tone of text,"Sentiment analysis classifies text as positive, negative, or neutral."
NLP,4,What is the Transformer architecture based on?,Recurrence,Convolution,Graph networks,Self-attention mechanism,Transformers use self-attention to process all tokens in parallel.
NLP,4,What does BERT stand for?,Basic Embedding Recurrent Transformer,Batch Encoding Regression Tool,Bidirectional Evaluation Representation Tool,Bidirectional Encoder Representations from Transformers,BERT reads text bidirectionally for deep context understanding.
NLP,5,What does GPT stand for?,Graph Processing Tool,Gated Prediction Transformer,General Purpose Transformer,Generative Pretrained Transformer,GPT is an autoregressive language model that generates text by predicting the next token.
NLP,5,What is fine-tuning in NLP?,Training from scratch,Data augmentation,Model pruning,Adapting pretrained model to specific task,Fine-tuning updates a pretrained model on task-specific data.
NLP,3,What is text summarization?,Translation,Classification,Sentiment detection,Condensing text to key points,Text summarization produces a shorter version of a document preserving key information.
NLP,4,What is machine translation?,Text classification,Summarization,Named entity recognition,Automatically translating between languages,Machine translation uses models to automatically convert text from one language to another.
Computer Vision,1,What is image classification?,Object detection,Image segmentation,Image generation,Assigning a label to an image,Image classification assigns a single category label to an entire image.
Computer Vision,1,What is object detection?,Image classification,Image generation,Image segmentation,Locating and classifying objects in images,Object detection identifies and localizes multiple objects within an image.
Computer Vision,2,What is image segmentation?,Object detection,Image classification,Feature extraction,Partitioning image into pixel-level regions,Image segmentation assigns a class label to every pixel in an image.
Computer Vision,2,What is data augmentation in CV?,Model compression,Feature extraction,Batch normalization,Artificially expanding training data,Data augmentation applies transformations to increase dataset diversity.
Computer Vision,3,What is a feature map in CNN?,Input image,Pooling result,Weight matrix,Output of a convolutional layer,Feature maps are the outputs of convolutional layers representing detected patterns.
Computer Vision,3,What does YOLO stand for?,You Only Learn Once,Your Object Learning Output,Yield Optimized Layer Output,You Only Look Once,YOLO detects objects in a single forward pass for real-time performance.
Computer Vision,4,What is image super-resolution?,Reducing image size,Image compression,Image classification,Increasing image resolution using AI,Super-resolution reconstructs high-resolution images from low-resolution inputs.
Computer Vision,4,What is optical flow?,Color detection,Edge detection,Object tracking,Estimating motion between frames,Optical flow estimates the apparent motion of objects between consecutive video frames.
Computer Vision,5,What is a Vision Transformer?,CNN variant,RNN for images,Capsule network,Transformer applied to image patches,ViT splits images into patches and applies transformer self-attention.
Computer Vision,5,What is contrastive learning in CV?,Supervised classification,Object detection,Image segmentation,Learning by comparing similar/dissimilar pairs,Contrastive learning trains models to bring similar samples closer and push dissimilar ones apart.
Computer Vision,3,What is edge detection?,Color extraction,Object tracking,Image compression,Finding boundaries in images,Edge detection identifies sharp changes in intensity that correspond to object boundaries.
Reinforcement Learning,1,What is an agent in RL?,Dataset,Loss function,Reward signal,Entity that takes actions in environment,The agent is the learner that interacts with the environment to maximize reward.
Reinforcement Learning,1,What is a reward in RL?,Penalty only,Model weight,Training label,Feedback signal from environment,Rewards are scalar signals the agent receives after each action.
Reinforcement Learning,2,What is a policy in RL?,Dataset,Reward function,Value function,Mapping from states to actions,A policy defines the agent behavior by mapping each state to an action.
Reinforcement Learning,2,What is the Q-value?,Immediate reward only,Policy gradient,State value only,Expected cumulative reward for state-action pair,Q-value estimates the total expected reward from taking an action in a state.
Reinforcement Learning,3,What is Q-learning?,Policy gradient method,Actor-critic method,Model-based planning,Model-free RL algorithm using Q-values,Q-learning learns the optimal action-value function without a model of the environment.
Reinforcement Learning,3,What is the exploration-exploitation tradeoff?,Bias-variance tradeoff,Overfitting tradeoff,Speed-accuracy tradeoff,Balancing new actions vs known good actions,The agent must balance exploring new actions and exploiting known rewarding ones.
Reinforcement Learning,4,What is Deep Q-Network (DQN)?,Policy gradient method,Model-based RL,Actor-critic method,Q-learning with neural network function approximation,DQN uses a neural network to approximate Q-values for high-dimensional inputs.
Reinforcement Learning,4,What does the Bellman equation express?,Loss function,Reward shaping,Policy gradient,Recursive relationship for value functions,The Bellman equation expresses the value of a state as immediate reward plus discounted future value.
Reinforcement Learning,5,What does PPO stand for?,Partial Policy Optimization,Probabilistic Policy Output,Predictive Policy Optimization,Proximal Policy Optimization,PPO clips updates to prevent large destabilizing policy changes.
Reinforcement Learning,5,What is the actor-critic method?,Single network RL,Model-based planning,Pure policy gradient,Combines policy and value function networks,Actor-critic uses an actor to select actions and a critic to evaluate them.
Data Science,1,What is a DataFrame?,Database table,Neural network layer,Graph structure,2D labeled data structure in pandas,A DataFrame is a 2D tabular data structure with labeled rows and columns.
Data Science,1,What does EDA stand for?,Error Detection Algorithm,Efficient Data Algorithm,Exploratory Deep Analysis,Exploratory Data Analysis,EDA involves summarizing and visualizing data to understand its structure.
Data Science,2,What is a null value?,Zero value,Negative number,Empty string,Missing or undefined data,Null values represent missing data and must be handled before model training.
Data Science,2,What is feature scaling?,Adding features,Removing features,Creating new features,Normalizing feature ranges,Feature scaling standardizes the range of features to prevent dominance by large values.
Data Science,3,What does PCA stand for?,Partial Correlation Analysis,Predictive Clustering Algorithm,Probabilistic Component Analysis,Principal Component Analysis,PCA reduces dimensionality by projecting data onto principal components of maximum variance.
Data Science,3,What does a correlation matrix show?,Confusion matrix values,Covariance values,Loss values,Pairwise feature correlations,A correlation matrix displays correlation coefficients between all pairs of features.
Data Science,4,What is the curse of dimensionality?,Too little data,Overfitting problem,Underfitting problem,Performance degrades with high dimensions,"As dimensions increase, data becomes sparse and distance metrics lose meaning."
Data Science,4,What does SMOTE do?,Feature selection,Dimensionality reduction,Data cleaning,Generates synthetic minority class samples,SMOTE generates synthetic samples for minority classes to address class imbalance.
Data Science,5,What is A/B testing?,Model comparison,Data cleaning,Feature engineering,Controlled experiment comparing two variants,A/B testing compares two versions of a system to determine which performs better.
Python,1,What is a Python list?,Immutable sequence,Dictionary,Tuple,Mutable ordered collection,A Python list is a mutable ordered collection that can hold items of any type.
Python,1,What does len() return?,Sorts a list,Reverses a list,Sums a list,Length of an object,len() returns the number of items in an object like a list or string.
Python,2,What is a lambda function?,Class method,Generator,Decorator,Anonymous inline function,Lambda functions are small anonymous functions defined with the lambda keyword.
Python,2,What is list comprehension?,Loop syntax,Dictionary method,Generator expression,Concise way to create lists,List comprehensions provide a compact syntax to create lists from iterables.
Python,2,What is a decorator in Python?,Data type,Module,Class method,Function that wraps another function,Decorators modify or extend the behavior of functions without changing their source code.
Python,3,What is a generator in Python?,List type,Class type,Iterator class,Function that yields values lazily,"Generators produce values one at a time using yield, saving memory for large sequences."
Python,3,What is the GIL in Python?,Graphics Interface Layer,General Import Library,Global Index Lock,Global Interpreter Lock,The GIL prevents multiple threads from executing Python bytecode simultaneously.
Python,4,What is asyncio used for?,Database access,File compression,Image processing,Asynchronous I/O programming,asyncio enables writing concurrent code using async/await syntax for I/O-bound tasks.
Python,4,What is a context manager?,Error handler,Thread manager,Memory allocator,Manages resource setup and teardown,Context managers use __enter__ and __exit__ to manage resources like files automatically.
Python,5,What is a metaclass in Python?,Base class,Module type,Abstract class,Class of a class,Metaclasses define the behavior of classes themselves enabling class creation customization.
Algorithms,1,What does time complexity measure?,Memory usage,Code length,Number of variables,Algorithm runtime growth relative to input,Time complexity describes how runtime grows relative to input size using Big O notation.
Algorithms,1,What is O(1) complexity?,Linear time,Quadratic time,Logarithmic time,Constant time regardless of input,O(1) means the algorithm takes the same time regardless of input size.
Algorithms,2,What is binary search time complexity?,O(n),O(n^2),O(n log n),O(log n),Binary search halves the search space each step giving O(log n) time complexity.
Algorithms,2,Which sort is best for nearly sorted data?,Quicksort,Merge Sort,Heap Sort,Insertion Sort,Insertion sort runs in O(n) for nearly sorted data making it optimal in that case.
Algorithms,3,What is dynamic programming?,Greedy approach,Divide and conquer,Brute force,Solving problems by storing subproblem results,DP solves complex problems by breaking them into overlapping subproblems and caching results.
Algorithms,3,What is merge sort time complexity?,O(n),O(n^2),O(log n),O(n log n),Merge sort divides the array in half recursively and merges giving O(n log n) always.
Algorithms,4,What is a greedy algorithm?,Exhaustive search,Dynamic programming,Backtracking,Makes locally optimal choices at each step,Greedy algorithms make the best immediate choice hoping to find the global optimum.
Algorithms,4,What is Dijkstra's algorithm used for?,Sorting arrays,Tree traversal,Graph coloring,Shortest path in weighted graphs,Dijkstra finds the shortest path from a source to all nodes in a non-negative weighted graph.
Algorithms,5,What does P vs NP ask?,Sorting complexity,Graph complexity,Space complexity,Whether NP problems can be solved in polynomial time,P vs NP asks if problems verifiable in polynomial time can also be solved in polynomial time.
Data Structures,1,What ordering does a stack use?,FIFO,Random,Priority-based,LIFO,A stack follows Last In First Out - the last element added is the first to be removed.
Data Structures,1,What ordering does a queue use?,LIFO,Random,Priority-based,FIFO,A queue follows First In First Out - elements are added at back and removed from front.
Data Structures,2,What is a linked list?,Array variant,Hash table,Binary tree,Nodes connected by pointers,A linked list stores elements in nodes where each node points to the next node.
Data Structures,2,What is a binary tree?,Linear structure,Graph,Hash table,Tree where each node has at most 2 children,A binary tree is a hierarchical structure where each node has at most a left and right child.
Data Structures,3,What is a hash table?,Sorted array,Linked list,Binary tree,Key-value store with O(1) average access,Hash tables use a hash function to map keys to indices for fast average-case O(1) lookup.
Data Structures,3,What property does a heap satisfy?,All nodes equal,Sorted order,Random order,Parent always greater or smaller than children,A heap is a complete binary tree where parent nodes are always greater or smaller than children.
Data Structures,4,What is a graph?,Linear structure,Tree variant,Hash table,Nodes connected by edges,A graph consists of vertices and edges representing relationships between entities.
Data Structures,4,What is a trie optimized for?,Sorting numbers,Graph traversal,Numerical computation,Prefix-based string search,A trie stores strings character by character enabling fast prefix-based search.
Data Structures,5,What is a segment tree used for?,Sorting,Graph traversal,String matching,Range queries and updates in O(log n),Segment trees efficiently answer range queries like sum or min over array intervals.
Linear Algebra,1,What is a vector?,Scalar value,Matrix,Tensor,Ordered list of numbers,A vector is an ordered collection of numbers representing magnitude and direction.
Linear Algebra,2,What is matrix multiplication?,Element-wise product,Matrix addition,Matrix transpose,Dot product of rows and columns,Matrix multiplication computes the dot product of rows of the first matrix with columns of the second.
Linear Algebra,3,What is an eigenvalue?,Matrix rank,Determinant,Trace,Scalar satisfying Av = lambda*v,Eigenvalues are scalars where a matrix transformation only scales the eigenvector.
Linear Algebra,3,What does SVD stand for?,Standard Vector Division,Sparse Value Detection,Symmetric Value Decomposition,Singular Value Decomposition,"SVD factorizes a matrix into U, Sigma, V^T used in dimensionality reduction."
Linear Algebra,4,What is the dot product?,Cross product,Matrix inverse,Outer product,Sum of element-wise products,The dot product of two vectors is the sum of the products of their corresponding elements.
Probability,1,What range does probability take?,Negative to positive,0 to 100,Any real number,0 to 1,Probability measures the likelihood of an event occurring ranging from 0 to 1.
Probability,2,What is conditional probability P(A|B)?,P(A) + P(B),P(A) * P(B),P(A) / P(B),Probability of A given B has occurred,Conditional probability is the probability of event A occurring given that B has occurred.
Probability,3,What does Bayes theorem relate?,Mean and variance,Frequency and probability,Correlation and causation,Prior and posterior probabilities,Bayes theorem updates the probability of a hypothesis given new evidence.
Probability,3,What is a probability distribution?,Single value,Histogram only,Frequency table,Function describing likelihood of outcomes,A probability distribution describes the likelihood of each possible outcome of a random variable.
Statistics,2,What is the mean?,Most frequent value,Middle value,Square root of variance,Average of all values,The mean is the sum of all values divided by the count representing central tendency.
Statistics,2,What is standard deviation?,Mean value,Median,Mode,Measure of data spread around mean,Standard deviation quantifies how much values deviate from the mean on average.
Statistics,3,What does the central limit theorem state?,Law of large numbers,Bayes theorem,Regression to mean,Sample means approach normal distribution,CLT states that the distribution of sample means approaches normal as sample size increases.
