topic,difficulty,question,option_a,option_b,option_c,correct_answer,explanation
Transformers,4,What is flash attention?,An attention variant for image models,An attention mechanism using sparse patterns,An attention method that uses random projections,An IO-aware exact attention algorithm that reduces memory usage and speeds up computation,Flash attention reorders attention computation to minimize memory reads and writes enabling training of models with much longer sequences.
Transformers,4,What is the purpose of the scaling factor in scaled dot-product attention?,To increase the attention scores,To normalize the output embeddings,To reduce the number of heads,To prevent dot products from growing too large and causing vanishing gradients in softmax,Dividing by the square root of the key dimension keeps dot products in a range where softmax has useful gradients.
Transformers,5,What is ALiBi positional encoding?,A learned positional embedding,A sinusoidal encoding added to embeddings,A relative position encoding using rotations,A method that adds a linear bias to attention scores based on token distance,ALiBi adds a fixed linear penalty to attention scores based on distance between tokens enabling extrapolation to longer sequences than seen during training.
Transformers,5,What is the purpose of the residual connections in Transformers?,To skip the attention computation,To reduce the number of parameters,To normalize the gradients,To allow gradients to flow directly through the network and enable training of deep models,Residual connections add the input of each sub-layer to its output helping gradients flow during backpropagation and enabling very deep Transformer stacks.
Transformers,5,What is grouped query attention (GQA)?,Attention applied to groups of tokens,Attention with grouped heads sharing the same output,Attention that groups similar queries,A variant where multiple query heads share a single key-value head to reduce memory,GQA reduces the KV cache size by having groups of query heads share key and value projections balancing efficiency and model quality.
Transformers,2,What is the vocabulary size in a typical LLM Transformer?,10,100,1000,Typically 32000 to 100000 tokens,Modern LLMs use vocabularies of tens of thousands of subword tokens created by algorithms like BPE or SentencePiece.
Transformers,3,What is the role of the value matrix in attention?,To compute similarity scores,To determine which tokens to attend to,To encode positional information,To produce the weighted combination of information from attended positions,The value matrix transforms token representations into the content that gets aggregated based on the attention weights.
Prompt Engineering,1,What is prompt engineering?,Training a new model,Modifying model weights,Compressing model inputs,Designing effective inputs to guide AI model outputs,Prompt engineering involves crafting instructions and context to elicit desired responses from language models without changing their weights.
Prompt Engineering,1,What is a system prompt?,A prompt that crashes the model,A prompt used during training,A prompt that sets the output format,A prompt that defines the model's role and behavior for a conversation,System prompts provide high-level instructions to the model about its persona constraints and goals before the user conversation begins.
Prompt Engineering,2,What is few-shot prompting in prompt engineering?,Prompting with very short inputs,Prompting without any examples,Prompting with a single example,Including several input-output examples in the prompt to demonstrate the task,Few-shot prompting provides the model with demonstrations of the desired behavior helping it understand the expected format and style.
Prompt Engineering,2,What is zero-shot prompting?,Prompting with zero tokens,Prompting with no system message,Prompting with many examples,Asking the model to perform a task with no examples provided,Zero-shot prompting relies entirely on the model's pre-trained knowledge to complete a task without any demonstrations.
Prompt Engineering,2,What is chain-of-thought (CoT) prompting?,A method to chain multiple API calls,A technique to link prompts together,A way to compress reasoning steps,Encouraging the model to show step-by-step reasoning before giving an answer,CoT prompting improves accuracy on complex reasoning tasks by having the model articulate intermediate steps before reaching a conclusion.
Prompt Engineering,3,What is self-consistency in prompt engineering?,Ensuring the prompt has no typos,Using the same prompt every time,Avoiding contradictions in the system prompt,Sampling multiple reasoning paths and selecting the most common answer,Self-consistency improves reliability by generating multiple chain-of-thought solutions and taking a majority vote over the final answers.
Prompt Engineering,3,What is ReAct prompting?,A prompting style for reactive systems,A method to reduce hallucinations,A technique to format outputs as JSON,A framework combining reasoning traces and actions for tool-using agents,ReAct interleaves reasoning steps with actions like tool calls allowing models to gather information and reason about it iteratively.
Prompt Engineering,3,What is a prompt template?,A pre-trained model for prompting,A fixed output format,A type of fine-tuning,A reusable structure with placeholders for dynamic content,Prompt templates standardize the format of prompts by defining a structure where specific variables are filled in at runtime.
Prompt Engineering,3,What is output formatting in prompt engineering?,Changing the model's tokenizer,Adjusting the model's temperature,Modifying the training data,Instructing the model to return responses in a specific structure like JSON or markdown,Specifying output format in the prompt helps ensure the model returns structured data that downstream systems can reliably parse.
Prompt Engineering,4,What is prompt chaining?,Linking prompts to training data,Combining multiple models,Repeating the same prompt,Breaking a complex task into sequential prompts where each output feeds the next,Prompt chaining decomposes complex workflows into manageable steps improving reliability and allowing intermediate verification.
Prompt Engineering,4,What is the role of delimiters in prompts?,To end the conversation,To separate training examples,To mark the end of a token,To clearly separate different sections of a prompt such as instructions and input,Delimiters like triple quotes or XML tags help the model distinguish between instructions context and user input reducing confusion.
Prompt Engineering,4,What is meta-prompting?,Prompting about hardware specs,Prompting to change model weights,Prompting to retrieve training data,Using a prompt to generate or improve other prompts,Meta-prompting leverages the model's language understanding to automatically create or refine prompts for specific tasks.
Prompt Engineering,5,What is automatic prompt optimization?,Manually writing better prompts,Compressing prompts to save tokens,Using a fixed prompt for all tasks,Using algorithms to automatically search for high-performing prompts,Automatic prompt optimization methods like APE use the model itself or search algorithms to find prompts that maximize task performance.
Prompt Engineering,5,What is the tree of thoughts prompting technique?,A hierarchical prompt structure,A method to organize system prompts,A way to format outputs as trees,A framework where the model explores multiple reasoning branches and evaluates them,Tree of Thoughts extends chain-of-thought by allowing the model to consider multiple reasoning paths and backtrack enabling more deliberate problem solving.
Prompt Engineering,2,What is role prompting?,Assigning a role to the user,Defining the model's training role,Setting the output language,Instructing the model to adopt a specific persona or expert role,Role prompting like asking the model to act as an expert can improve response quality by activating relevant knowledge patterns.
Prompt Engineering,4,What is prompt injection?,A method to speed up prompts,A technique to add context,A way to compress long prompts,An attack where malicious text in the input overrides the original instructions,Prompt injection is a security vulnerability where adversarial content in user input manipulates the model into ignoring its original instructions.
Prompt Engineering,3,What is the difference between a prompt and a completion?,A completion is the input and a prompt is the output,They are the same thing,A prompt is a model weight update,A prompt is the input to the model and a completion is the model's generated response,The prompt is what you send to the model and the completion is the text the model generates in response.
Prompt Engineering,5,What is soft prompting?,Using informal language in prompts,Avoiding technical terms in prompts,Using shorter prompts,Prepending learnable continuous vectors to the input instead of discrete text tokens,Soft prompting or prompt tuning optimizes continuous embeddings prepended to the input allowing task adaptation without modifying model weights.
Prompt Engineering,1,What is the purpose of giving context in a prompt?,To increase the model's temperature,To reduce the token count,To change the model's architecture,To help the model understand the background and produce more relevant responses,Providing context in a prompt gives the model the information it needs to generate accurate and relevant responses.
Prompt Engineering,2,What is a negative prompt?,A prompt that insults the model,A prompt with no instructions,A prompt that reduces model confidence,Instructions telling the model what to avoid or exclude in its response,Negative prompts guide the model away from unwanted content styles or behaviors improving output quality and safety.
Fine-tuning,1,What is fine-tuning in machine learning?,Training a model from scratch,Evaluating a model on test data,Compressing a model's weights,Continuing training a pre-trained model on a specific dataset,Fine-tuning adapts a pre-trained model to a new task by training it further on task-specific data with a lower learning rate.
Fine-tuning,1,Why is fine-tuning preferred over training from scratch?,It requires more data,It always produces worse results,It is slower than training from scratch,It is faster and requires less data by leveraging pre-trained knowledge,Fine-tuning takes advantage of representations already learned during pre-training reducing the data and compute needed for a new task.
Fine-tuning,2,What is LoRA in the context of fine-tuning?,A type of learning rate scheduler,A regularization technique,A data augmentation method,Low-Rank Adaptation which adds trainable low-rank matrices to frozen model weights,LoRA reduces the number of trainable parameters by decomposing weight updates into low-rank matrices making fine-tuning efficient.
Fine-tuning,2,What is catastrophic forgetting in fine-tuning?,When the model forgets the task,When training loss increases,When the model runs out of memory,When fine-tuning on new data causes the model to lose previously learned knowledge,Catastrophic forgetting occurs when gradient updates for new tasks overwrite the weights that encoded knowledge from pre-training.
Fine-tuning,2,What is the learning rate typically set to during fine-tuning?,The same as pre-training,Higher than pre-training,Zero,Lower than pre-training to avoid overwriting learned representations,A small learning rate during fine-tuning prevents large weight updates that would destroy the useful representations learned during pre-training.
Fine-tuning,3,What is QLoRA?,A quantized version of the attention mechanism,A quality metric for fine-tuning,A query-based LoRA variant,Fine-tuning using quantized base model weights combined with LoRA adapters,QLoRA enables fine-tuning of large models on consumer hardware by quantizing the base model to 4-bit precision and training only LoRA adapters.
Fine-tuning,3,What is instruction fine-tuning?,Fine-tuning on code only,Fine-tuning to reduce model size,Fine-tuning on raw text corpora,Fine-tuning a model on pairs of instructions and desired responses,Instruction fine-tuning teaches models to follow natural language instructions by training on curated datasets of instruction-response pairs.
Fine-tuning,3,What is PEFT?,Partial Embedding Fine-Tuning,Probabilistic Ensemble Fine-Tuning,Parallel Efficient Feature Training,Parameter-Efficient Fine-Tuning methods that update only a small subset of parameters,PEFT methods like LoRA and prefix tuning reduce the cost of fine-tuning by keeping most model weights frozen and only training a small number of new parameters.
Fine-tuning,4,What is DPO (Direct Preference Optimization)?,A data preprocessing optimization,A distributed training protocol,A dynamic prompt optimizer,A fine-tuning method that directly optimizes for human preferences without a separate reward model,DPO simplifies RLHF by reformulating preference learning as a classification problem eliminating the need to train a separate reward model.
Fine-tuning,4,What is the purpose of a reward model in RLHF fine-tuning?,To generate training data,To compress model weights,To evaluate perplexity,To score model outputs based on human preference signals,The reward model is trained on human preference data and provides scalar rewards used to optimize the language model via reinforcement learning.
Fine-tuning,4,What is adapter-based fine-tuning?,Replacing all model layers,Training only the embedding layer,Freezing the entire model,Adding small trainable modules between frozen layers,Adapter layers are small bottleneck modules inserted into a pre-trained model allowing task-specific learning with minimal parameter overhead.
Fine-tuning,5,What is the rank parameter in LoRA?,The number of training epochs,The batch size used for fine-tuning,The learning rate multiplier,The dimensionality of the low-rank decomposition matrices,The rank r in LoRA controls the expressiveness of the weight update with lower rank meaning fewer parameters and higher rank allowing more complex adaptations.
Fine-tuning,5,What is continual learning in the context of fine-tuning?,Training on a single task forever,Fine-tuning with a constant learning rate,Training without any data,Sequentially fine-tuning on new tasks while retaining performance on previous tasks,Continual learning addresses catastrophic forgetting by using techniques like elastic weight consolidation or replay buffers to preserve old knowledge.
Fine-tuning,3,What is domain adaptation in fine-tuning?,Changing the model architecture,Adapting the tokenizer vocabulary,Translating training data,Fine-tuning a model on data from a specific domain to improve performance in that area,Domain adaptation fine-tunes a general model on domain-specific text such as medical or legal documents to improve its specialized knowledge.
Fine-tuning,2,What is the difference between full fine-tuning and PEFT?,Full fine-tuning is always better,PEFT trains more parameters,Full fine-tuning uses less memory,Full fine-tuning updates all model weights while PEFT updates only a small subset,Full fine-tuning is more expressive but computationally expensive while PEFT methods achieve comparable results with far fewer trainable parameters.
RAG,1,What does RAG stand for?,Recursive Attention Generation,Regularized Autoregressive Generation,Random Augmented Grounding,Retrieval-Augmented Generation,RAG combines information retrieval with language generation to ground model responses in external knowledge sources.
RAG,1,What problem does RAG primarily solve?,Slow inference speed,High training cost,Model size reduction,Outdated or missing knowledge in the model's parameters,RAG allows models to access up-to-date or domain-specific information at inference time without requiring retraining.
RAG,2,What is a vector database used for in RAG?,Storing model weights,Caching API responses,Logging user queries,Storing and searching document embeddings for retrieval,Vector databases enable efficient similarity search over dense embeddings allowing RAG systems to find relevant documents quickly.
RAG,2,What is the retriever component in RAG?,The component that generates the final answer,The component that tokenizes the query,The component that trains the model,The component that searches for relevant documents given a query,The retriever takes a user query and returns the most semantically similar documents from the knowledge base.
RAG,2,What is chunking in RAG?,Splitting the model into parts,Batching training examples,Compressing embeddings,Splitting documents into smaller pieces for indexing and retrieval,Chunking divides large documents into manageable segments so that the most relevant portions can be retrieved and fit within the model's context window.
RAG,3,What is dense retrieval in RAG?,Retrieval using keyword matching,Retrieval from compressed databases,Retrieval using decision trees,Retrieval using dense vector embeddings to find semantically similar documents,Dense retrieval encodes both queries and documents into embedding space and uses approximate nearest neighbor search to find relevant content.
RAG,3,What is the difference between sparse and dense retrieval?,Sparse retrieval is always better,Dense retrieval uses keyword matching,Sparse retrieval uses neural embeddings,Sparse retrieval uses term frequency methods like BM25 while dense retrieval uses neural embeddings,Sparse retrieval is fast and interpretable while dense retrieval captures semantic similarity beyond exact keyword matches.
RAG,3,What is re-ranking in RAG?,Sorting documents by date,Re-ordering model outputs,Re-training the retriever,Using a more powerful model to re-score retrieved documents for relevance,Re-ranking applies a cross-encoder or other model to the top retrieved candidates to improve the final ordering before passing to the generator.
RAG,4,What is HyDE in RAG?,A hyperparameter tuning method,A hybrid dense encoder,A hierarchical document embedding,Hypothetical Document Embeddings where the model generates a hypothetical answer to improve retrieval,HyDE generates a hypothetical answer to the query and uses its embedding for retrieval often finding more relevant documents than query-only search.
RAG,4,What is a knowledge graph used for in advanced RAG?,Storing model checkpoints,Compressing document embeddings,Replacing the language model,Representing structured relationships between entities to enhance retrieval,Knowledge graphs provide structured relational information that can complement dense retrieval by capturing explicit entity relationships.
RAG,4,What is the context stuffing problem in RAG?,When the model generates too much text,When retrieval returns no results,When the model ignores the system prompt,When too many retrieved documents exceed the model's context window,Context stuffing occurs when retrieved content is too long to fit in the context window requiring strategies like summarization or selective inclusion.
RAG,5,What is FLARE in RAG?,A fine-tuning method for retrievers,A loss function for RAG training,A fast embedding algorithm,Forward-Looking Active Retrieval that triggers retrieval when the model is uncertain,FLARE monitors the model's confidence during generation and proactively retrieves new information when it predicts low-confidence tokens.
RAG,5,What is self-RAG?,A RAG system without a retriever,A RAG system that trains itself,A RAG system using only the model's memory,A model that decides when to retrieve and critiques its own outputs using special tokens,Self-RAG trains the model to adaptively retrieve information and reflect on the quality of retrieved passages and generated responses.
RAG,3,What is metadata filtering in RAG?,Filtering out stop words,Removing duplicate embeddings,Compressing document chunks,Using document metadata like date or source to narrow the retrieval search space,Metadata filtering improves retrieval precision by restricting the search to documents matching specific attributes before semantic search.
RAG,2,What is the generator component in RAG?,The component that indexes documents,The component that embeds queries,The component that retrieves documents,The language model that produces the final answer using retrieved context,The generator takes the user query and retrieved documents as context and produces a grounded natural language response.
AI Agents,1,What is an AI agent?,A static lookup table,A rule-based chatbot,A database query engine,An autonomous system that perceives its environment and takes actions to achieve goals,AI agents combine perception reasoning and action to operate autonomously in pursuit of specified objectives.
AI Agents,1,What is the perceive-reason-act loop in AI agents?,A training algorithm,A data preprocessing pipeline,A model evaluation method,The cycle where an agent observes its environment reasons about it and takes an action,This loop is the fundamental operating cycle of AI agents enabling them to interact with and adapt to dynamic environments.
AI Agents,2,What is a tool in the context of AI agents?,A hardware component,A training dataset,A model architecture,A function or API the agent can call to interact with external systems,Tools extend an agent's capabilities by allowing it to perform actions like web search code execution or database queries.
AI Agents,2,What is an agent's memory?,The model's parameter count,The training data size,The GPU memory used,The ability to store and retrieve information across interactions,Agent memory allows the system to maintain context learn from past interactions and build up knowledge over time.
AI Agents,2,What is planning in AI agents?,Selecting the model architecture,Choosing the training objective,Compressing the action space,Decomposing a goal into a sequence of steps or sub-tasks,Planning enables agents to tackle complex goals by breaking them into manageable actions and reasoning about their order and dependencies.
AI Agents,3,What is the ReAct framework for agents?,A reactive programming framework,A reinforcement learning algorithm,A retrieval augmentation technique,A framework combining reasoning traces with action execution in an interleaved manner,ReAct allows agents to think step by step and take actions based on observations creating a tight loop between reasoning and doing.
AI Agents,3,What is an agent's action space?,The set of training examples,The set of model parameters,The set of possible inputs,The set of all possible actions the agent can take,The action space defines what an agent can do such as calling tools sending messages or modifying state.
AI Agents,3,What is a scratchpad in AI agents?,A temporary model checkpoint,A cache for embeddings,A log of training losses,A working memory where the agent records intermediate thoughts and observations,The scratchpad allows agents to maintain a chain of thought across multiple steps helping them reason through complex multi-step tasks.
AI Agents,3,What is goal decomposition in AI agents?,Splitting the model into sub-models,Dividing the training data,Reducing the action space,Breaking a high-level goal into smaller achievable sub-goals,Goal decomposition enables agents to handle complex objectives by recursively breaking them down into simpler tasks that can be executed sequentially.
AI Agents,4,What is the difference between reactive and deliberative agents?,Reactive agents are slower,Deliberative agents use less memory,Reactive agents plan ahead,Reactive agents respond directly to stimuli while deliberative agents build internal models and plan,Reactive agents are fast and simple while deliberative agents reason about the world and plan sequences of actions to achieve goals.
AI Agents,4,What is an agent executor?,A hardware accelerator,A training optimizer,A data loader,The runtime that manages the agent loop calling tools and passing results back to the model,The agent executor orchestrates the interaction between the language model and tools handling the loop of reasoning and action.
AI Agents,4,What is grounding in AI agents?,Connecting the agent to the internet,Reducing the agent's output length,Limiting the agent's action space,Connecting the agent's outputs to real-world facts or external data sources,Grounding prevents hallucination by anchoring the agent's responses in verified external information retrieved from tools or databases.
AI Agents,4,What is an agent's observation?,The model's training loss,The agent's internal state,The user's original query,The information returned to the agent after taking an action,Observations are the results of tool calls or environment interactions that the agent uses to update its reasoning and plan next steps.
AI Agents,5,What is the exploration-exploitation tradeoff in agent systems?,Choosing between training and inference,Balancing model size and speed,Deciding between retrieval and generation,Balancing trying new actions to discover better strategies versus using known good actions,Agents must decide when to explore new strategies that might yield better outcomes versus exploiting known effective approaches.
AI Agents,5,What is a world model in AI agents?,A global knowledge base,A multilingual language model,A model trained on all domains,An internal representation the agent uses to simulate and predict the effects of actions,World models allow agents to reason about consequences before acting enabling more efficient planning and reducing costly real-world mistakes.
AI Agents,2,What is an autonomous agent?,An agent that requires constant human input,An agent that only answers questions,An agent that runs on specialized hardware,An agent that can complete multi-step tasks without human intervention,Autonomous agents operate independently by planning executing and adapting their behavior to achieve goals with minimal human oversight.
