topic,difficulty,question,option_a,option_b,option_c,correct_answer,explanation
Statistics,3,What is a p-value?,Effect size,Confidence interval,Sample size,Probability of results given null hypothesis is true,The p-value measures the probability of observing results at least as extreme as the data under the null hypothesis.
Calculus,2,What is a derivative?,Integral,Limit,Area under curve,Rate of change of a function,The derivative measures how a function changes as its input changes.
Calculus,3,What is the gradient in ML?,Scalar loss value,Weight matrix,Bias vector,Vector of partial derivatives,The gradient is a vector of partial derivatives indicating the direction of steepest ascent.
Calculus,3,What is the chain rule?,Product rule,Quotient rule,Power rule,Derivative of composite functions,The chain rule computes the derivative of a composite function by multiplying derivatives of each part.
Databases,1,What is SQL?,Scripting language,System Query Logic,Structured Query List,Structured Query Language for databases,SQL is a standard language for managing and querying relational databases.
Databases,2,What is a primary key?,Foreign key,Index,Unique constraint,Unique identifier for a table row,A primary key uniquely identifies each record in a database table.
Databases,2,What is database normalization?,Data encryption,Data compression,Data replication,Organizing data to reduce redundancy,Normalization organizes tables to minimize redundancy and improve data integrity.
Databases,3,What is a database index?,Primary key,Foreign key,Constraint,Data structure for faster queries,Indexes speed up data retrieval by creating a separate lookup structure for columns.
Databases,3,What does ACID stand for?,Acid test properties,Access Control ID,Async Concurrent Isolation Design,Atomicity Consistency Isolation Durability,ACID properties ensure reliable database transactions even in case of failures.
Databases,4,What is a NoSQL database?,Relational database,SQL variant,Normalized database,Non-relational flexible schema database,"NoSQL databases store data in flexible formats like documents, key-value, or graphs."
Operating Systems,1,What does an OS do?,Runs applications only,Stores files only,Manages network only,Manages hardware and software resources,An operating system manages hardware resources and provides services for application programs.
Operating Systems,2,What is a process?,File,Thread,Socket,Running instance of a program,"A process is an executing program with its own memory space, resources, and state."
Operating Systems,2,What is a thread?,Process,File descriptor,Socket,Lightweight unit of execution within a process,Threads share a process memory space and run concurrently enabling parallelism.
Operating Systems,3,What is deadlock?,Race condition,Memory leak,Starvation,Processes waiting for each other indefinitely,Deadlock occurs when processes are stuck waiting for resources held by each other.
Operating Systems,3,What is virtual memory?,CPU cache,RAM only,ROM,Extends RAM using disk storage,Virtual memory uses disk space to extend available RAM allowing larger programs to run.
Operating Systems,4,What is a semaphore?,Process type,Memory type,File type,Synchronization primitive for concurrency,Semaphores control access to shared resources by multiple processes using counters.
Networking,1,What is an IP address?,Domain name,MAC address,Port number,Unique numerical device identifier,An IP address is a unique numerical label assigned to each device on a network.
Networking,1,What does HTTP stand for?,High Transfer Text Protocol,Hyperlink Text Transfer Process,Hybrid Transfer Text Protocol,HyperText Transfer Protocol,HTTP is the protocol used for transmitting web pages over the internet.
Networking,2,What does TCP guarantee?,Fast delivery,Unordered delivery,Lossy delivery,Reliable ordered delivery,TCP ensures reliable ordered delivery of data between applications using acknowledgments.
Networking,2,What does DNS do?,Encrypts traffic,Routes packets,Assigns IP addresses,Translates domain names to IP addresses,DNS translates human-readable domain names into IP addresses for routing.
Networking,3,What is a firewall?,Router,Switch,Load balancer,Network security system filtering traffic,A firewall monitors and controls incoming and outgoing network traffic based on security rules.
Networking,3,What is REST API?,Database protocol,Network protocol,Messaging protocol,Architectural style for web services,REST is an architectural style using HTTP methods for stateless client-server communication.
Generative AI,1,What does generative AI primarily do?,Classify existing data,Delete redundant data,Compress datasets,Create new content such as text images or audio,Generative AI models learn patterns from training data and use them to produce novel outputs like text images audio or code.
Generative AI,1,Which of the following is a generative AI model?,Random Forest,Support Vector Machine,K-Nearest Neighbors,GPT-4,GPT-4 is a large generative AI model developed by OpenAI that can generate human-like text.
Generative AI,1,What type of data can generative AI produce?,Only numerical data,Only structured tables,Only binary outputs,Text images audio video and code,Generative AI is multimodal and can produce a wide variety of content types depending on the model architecture.
Generative AI,1,What does the term hallucination mean in generative AI?,When the model runs out of memory,When the model generates very slow outputs,When the model refuses to answer,When the model generates plausible but factually incorrect content,Hallucination refers to confident but incorrect outputs produced by generative models that are not grounded in facts.
Generative AI,1,What is a prompt in generative AI?,A hardware interrupt signal,A database query,A model checkpoint,The input text given to a generative model to guide its output,A prompt is the instruction or context provided to a generative model that shapes the content and style of its response.
Generative AI,2,What is a GAN?,A gradient accumulation network,A graph attention network,A gated activation node,A Generative Adversarial Network with a generator and discriminator,GANs consist of two neural networks that compete against each other to produce increasingly realistic synthetic data.
Generative AI,2,What is a diffusion model?,A model that spreads data across nodes,A model that diffuses gradients,A model that blurs inputs,A model that learns to reverse a noise process to generate data,Diffusion models generate data by learning to denoise progressively noisy versions of training samples.
Generative AI,2,What is the role of a discriminator in a GAN?,To generate fake samples,To encode input data,To compress latent vectors,To distinguish real data from generated data,The discriminator acts as a critic that tries to identify whether a given sample is real or produced by the generator.
Generative AI,2,What is latent space in generative models?,The output probability distribution,The training loss surface,The input feature matrix,A compressed representation of data used to generate new samples,Latent space is a lower-dimensional space where the model encodes data patterns and from which new samples can be decoded.
Generative AI,2,What is zero-shot generation?,Generating with zero training data,Generating with no GPU,Generating only one token,Generating outputs for tasks the model was not explicitly trained on,Zero-shot generation leverages the broad knowledge of large models to handle new tasks without any task-specific examples.
Generative AI,2,What is a text-to-image model?,A model that converts images to captions,A model that classifies text,A model that extracts text from images,A model that generates images from natural language descriptions,Text-to-image models like DALL-E and Stable Diffusion take text prompts as input and produce corresponding images.
Generative AI,3,What is mode collapse in GANs?,When the discriminator always wins,When gradients vanish during training,When the model overfits to noise,When the generator produces limited variety of outputs,Mode collapse occurs when the generator learns to produce only a narrow set of outputs that fool the discriminator.
Generative AI,3,What is a Variational Autoencoder (VAE)?,A model that only encodes data,A model that uses adversarial training,A model that classifies latent vectors,A generative model that encodes data into a distribution and samples from it,VAEs learn a probabilistic latent space and generate new data by sampling from the learned distribution.
Generative AI,3,What is temperature in text generation?,The hardware heat during inference,The learning rate schedule,The dropout probability,A parameter controlling randomness in token sampling,Higher temperature increases diversity and creativity in generated text while lower temperature makes outputs more deterministic.
Generative AI,3,What is top-p sampling?,Sampling from the top layer only,Selecting the highest probability token always,Sampling based on position encoding,Sampling from the smallest set of tokens whose cumulative probability exceeds p,Top-p nucleus sampling restricts token selection to a dynamic vocabulary based on cumulative probability threshold.
Generative AI,3,What distinguishes autoregressive generation?,Generating all tokens simultaneously,Using a fixed template,Copying from training data,Generating tokens one at a time conditioned on previous tokens,Autoregressive models generate sequences by predicting each token based on all previously generated tokens.
Generative AI,4,What is classifier-free guidance in diffusion models?,A method to remove the classifier head,A technique to skip gradient computation,A way to train without labels,A technique to steer generation using conditional and unconditional scores,Classifier-free guidance blends conditional and unconditional model outputs to improve sample quality and adherence to prompts.
Generative AI,4,What is the CLIP model used for in generative AI?,Clipping gradient norms,Compressing image files,Limiting token lengths,Aligning images and text in a shared embedding space,CLIP learns joint embeddings for images and text enabling text-guided image generation and retrieval.
Generative AI,4,What is a foundation model?,A model trained on a single task,A model with fixed weights,A model used only for classification,A large model pre-trained on broad data and adaptable to many tasks,Foundation models are trained at scale on diverse data and serve as a base for fine-tuning or prompting across many downstream tasks.
Generative AI,4,What is RLHF in the context of generative AI?,Recursive Layer Hierarchical Fusion,Regularized Loss with Heuristic Feedback,Random Latent Hidden Features,Reinforcement Learning from Human Feedback,RLHF aligns generative models with human preferences by training a reward model on human ratings and optimizing the generator with RL.
Generative AI,4,What is a token in generative AI?,A security credential,A database record,A pixel in an image,A unit of text such as a word or subword used by language models,Tokenization splits text into tokens which are the basic units processed by language models during training and inference.
Generative AI,5,What is the role of the KL divergence term in a VAE loss?,To measure reconstruction accuracy,To penalize large weights,To maximize likelihood directly,To regularize the latent space to follow a prior distribution,The KL divergence term in the VAE ELBO encourages the learned posterior to stay close to the prior enabling smooth sampling.
Generative AI,5,What is score matching in generative models?,Evaluating model accuracy on benchmarks,Matching output scores to labels,Ranking generated samples,A training objective that estimates the gradient of the data log-density,Score matching trains models to predict the score function of the data distribution enabling diffusion and energy-based models.
Generative AI,5,What is the evidence lower bound (ELBO) used for?,Computing cross-entropy loss,Measuring discriminator accuracy,Evaluating GAN performance,Optimizing variational inference by bounding the log-likelihood,The ELBO provides a tractable lower bound on the log-likelihood used to train VAEs and other latent variable models.
Generative AI,5,What is classifier guidance in diffusion models?,Using a classifier to filter outputs,Training a classifier on generated data,Replacing the diffusion process with classification,Using gradients from a classifier to steer the diffusion sampling process,Classifier guidance modifies the score function during sampling by adding gradients from a pre-trained classifier to improve conditional generation.
Generative AI,4,What is the purpose of a noise schedule in diffusion models?,To add noise to labels,To schedule GPU usage,To randomize batch order,To control how noise is added and removed during the diffusion process,The noise schedule defines the variance of noise added at each diffusion step affecting training stability and sample quality.
Generative AI,5,What is flow matching in generative modeling?,Matching data flows in pipelines,Aligning attention flows,Tracking gradient flows,A training method that learns a vector field to transport noise to data,Flow matching trains continuous normalizing flows by regressing on simple conditional vector fields enabling efficient high-quality generation.
Generative AI,3,What is prompt injection in generative AI?,A method to speed up inference,A technique to compress prompts,A way to add context to embeddings,An attack where malicious instructions are hidden in input to hijack model behavior,Prompt injection exploits the model tendency to follow instructions by embedding adversarial commands in user-provided text.
Generative AI,2,What is the generator's goal in a GAN?,To classify real vs fake images,To minimize reconstruction loss,To maximize the discriminator's accuracy,To produce samples that fool the discriminator,The generator is trained to produce outputs that the discriminator cannot distinguish from real data.
Generative AI,1,What is the main difference between discriminative and generative models?,Discriminative models are faster,Discriminative models use more data,Discriminative models have more layers,Generative models learn the data distribution while discriminative models learn decision boundaries,Generative models can create new samples while discriminative models focus on classifying or predicting labels.
Generative AI,3,What is a conditional generative model?,A model that only generates text,A model that requires no training,A model that generates random outputs,A model that generates outputs conditioned on a given input or label,Conditional generative models allow control over the generated output by conditioning on class labels text prompts or other signals.
LLMs,1,What does LLM stand for?,Layered Logic Module,Linear Learning Machine,Lightweight Language Mechanism,Large Language Model,LLM stands for Large Language Model which refers to neural networks trained on massive text corpora to understand and generate language.
LLMs,1,Which company created GPT-4?,Google,Meta,Anthropic,OpenAI,GPT-4 was developed by OpenAI and is one of the most capable large language models available.
LLMs,1,What is the primary training objective of most LLMs?,Image classification,Sentiment analysis,Named entity recognition,Predicting the next token in a sequence,Most LLMs are trained with a next-token prediction objective on large text datasets which teaches them language patterns.
LLMs,2,What is the context window of an LLM?,The model's training dataset size,The number of model parameters,The GPU memory used during inference,The maximum number of tokens the model can process at once,The context window defines how much text the model can consider at one time during both input and output generation.
LLMs,2,What is tokenization in LLMs?,Converting tokens to embeddings,Splitting the model into layers,Compressing model weights,Breaking text into smaller units called tokens for processing,Tokenization converts raw text into a sequence of tokens that the model can process using its vocabulary.
LLMs,2,What is an embedding in the context of LLMs?,A type of attention mechanism,A compression algorithm,A training loss function,A dense vector representation of a token or text,Embeddings map tokens or text to continuous vector spaces where semantic similarity corresponds to geometric proximity.
LLMs,2,What is perplexity as a metric for LLMs?,The number of model parameters,The training time in hours,The size of the vocabulary,A measure of how well a model predicts a text sample,Lower perplexity indicates the model assigns higher probability to the test text meaning it better models the language.
LLMs,3,What is in-context learning in LLMs?,Training the model on new data,Updating model weights at inference,Caching previous responses,Learning from examples provided in the prompt without weight updates,In-context learning allows LLMs to adapt to new tasks by conditioning on demonstrations in the prompt without any gradient updates.
LLMs,3,What is chain-of-thought prompting?,A method to chain multiple models,A technique to link API calls,A way to compress long prompts,A prompting technique that encourages step-by-step reasoning,Chain-of-thought prompting guides the model to produce intermediate reasoning steps leading to more accurate answers on complex tasks.
LLMs,3,What is the difference between GPT and BERT architectures?,BERT uses more parameters,GPT is bidirectional while BERT is unidirectional,GPT uses convolutional layers,GPT is autoregressive while BERT is bidirectional,GPT generates text left-to-right while BERT uses masked language modeling to learn bidirectional context.
LLMs,3,What is instruction tuning?,Training on raw text only,Training with adversarial examples,Training to minimize perplexity,Fine-tuning an LLM on instruction-response pairs to follow directions,Instruction tuning teaches models to follow natural language instructions making them more useful for real-world tasks.
LLMs,4,What is the scaling law in LLMs?,The rule that smaller models are better,The relationship between batch size and accuracy,The effect of dropout on performance,The empirical relationship between model size data and compute and performance,Scaling laws describe how model performance improves predictably as model size training data and compute are increased.
LLMs,4,What is sparse attention in LLMs?,Attention with zero weights,Attention applied only to the first token,Attention that ignores padding tokens,Attention that only computes scores for a subset of token pairs,Sparse attention reduces the quadratic complexity of full attention by limiting which token pairs interact enabling longer contexts.
LLMs,4,What is a mixture of experts (MoE) in LLMs?,A model trained by multiple teams,An ensemble of small models,A model with multiple output heads,A model architecture where only a subset of parameters are activated per token,MoE models route each token to a small number of expert sub-networks reducing computation while maintaining large model capacity.
LLMs,4,What is quantization in the context of LLMs?,Measuring model uncertainty,Counting model parameters,Splitting the model across GPUs,Reducing the numerical precision of model weights to decrease memory and speed up inference,Quantization converts weights from 32-bit floats to lower precision formats like 8-bit integers enabling deployment on resource-constrained hardware.
LLMs,5,What is the attention sink phenomenon in LLMs?,When attention scores are all equal,When the model ignores long contexts,When attention heads collapse,When initial tokens receive disproportionately high attention scores,Attention sinks occur when certain tokens like the first token accumulate high attention weights acting as a sink for attention mass.
LLMs,5,What is speculative decoding?,Decoding with lower precision,Decoding without a KV cache,Decoding using only the top token,Using a small draft model to propose tokens verified by the large model,Speculative decoding accelerates LLM inference by having a fast draft model generate candidate tokens that the main model verifies in parallel.
LLMs,5,What is the lost in the middle problem in LLMs?,When the model forgets its system prompt,When training loss plateaus,When the model generates empty outputs,When models struggle to use information from the middle of long contexts,Research shows LLMs perform better with information at the beginning or end of context and tend to miss details in the middle.
LLMs,4,What is a KV cache in LLMs?,A key-value database for storing prompts,A cache for model weights,A memory for storing training examples,A cache storing key and value tensors from previous tokens to speed up generation,The KV cache avoids recomputing attention keys and values for already-processed tokens significantly speeding up autoregressive generation.
LLMs,2,What is few-shot prompting?,Training the model on a few examples,Fine-tuning with limited data,Using a small model,Providing a few input-output examples in the prompt to guide the model,Few-shot prompting gives the model several demonstrations of the desired task format helping it generalize to new inputs.
Transformers,1,Who introduced the Transformer architecture?,Yann LeCun,Geoffrey Hinton,Andrew Ng,Vaswani et al. in the paper Attention Is All You Need,The Transformer architecture was introduced in 2017 by Vaswani and colleagues at Google in the landmark paper Attention Is All You Need.
Transformers,1,What is the core mechanism of the Transformer?,Recurrent connections,Convolutional filters,Pooling layers,Self-attention,Self-attention allows each token in a sequence to attend to all other tokens enabling the model to capture long-range dependencies.
Transformers,1,What does the encoder in a Transformer do?,Generate output tokens,Compute the final loss,Store model weights,Process the input sequence into contextual representations,The encoder transforms input tokens into rich contextual embeddings that capture relationships between all tokens in the sequence.
Transformers,2,What is multi-head attention?,Attention applied to multiple datasets,Attention with multiple loss functions,Attention computed across multiple layers,Running attention multiple times in parallel with different learned projections,Multi-head attention allows the model to jointly attend to information from different representation subspaces at different positions.
Transformers,2,What is positional encoding in Transformers?,A way to encode labels,A method to compress sequences,A technique to normalize activations,A method to inject sequence order information into token embeddings,Since Transformers have no inherent notion of order positional encodings add position information to token embeddings.
Transformers,2,What is the feed-forward network in a Transformer block?,A recurrent layer,A convolutional layer,An attention layer,A position-wise fully connected network applied after attention,Each Transformer block contains a feed-forward network that applies two linear transformations with a nonlinearity to each position independently.
Transformers,2,What is layer normalization in Transformers?,Normalizing the number of layers,Normalizing the learning rate,Normalizing the batch size,Normalizing activations across the feature dimension for each sample,Layer normalization stabilizes training by normalizing the activations within each layer independently for each training example.
Transformers,3,What is the difference between encoder-only and decoder-only Transformers?,Encoder-only models are larger,Decoder-only models use convolutions,Encoder-only models generate text,Encoder-only models produce representations while decoder-only models generate sequences,BERT is encoder-only suited for understanding tasks while GPT is decoder-only suited for generation tasks.
Transformers,3,What is masked self-attention in decoder Transformers?,Attention that ignores padding,Attention applied to masked images,Attention that drops random heads,Attention where each token can only attend to previous tokens,Masked self-attention enforces the autoregressive property by preventing tokens from attending to future positions during training.
Transformers,3,What is cross-attention in encoder-decoder Transformers?,Attention between two different models,Attention applied across batches,Attention between different layers,Attention where the decoder attends to encoder outputs,Cross-attention allows the decoder to focus on relevant parts of the encoded input sequence when generating each output token.
Transformers,3,What is the purpose of the softmax in attention?,To normalize weights to sum to one,To add nonlinearity to the network,To compute the dot product,To scale the query and key vectors,The softmax converts raw attention scores into a probability distribution over positions ensuring the attention weights sum to one.
Transformers,4,What is the computational complexity of full self-attention?,O(n log n),O(n),O(d^2),O(n^2) where n is the sequence length,Full self-attention computes pairwise interactions between all tokens resulting in quadratic complexity in sequence length.
Transformers,4,What is rotary positional embedding (RoPE)?,A learned absolute position embedding,A sinusoidal position encoding,A relative position bias added to attention logits,A positional encoding that rotates query and key vectors to encode relative positions,RoPE encodes relative position information by applying rotation matrices to queries and keys enabling better length generalization.
